file	transcription	duration
Chapter20_85_85.wav	cambio climatico	1.452625
Chapter20_87_87.wav	Και κυμπαριμάσκα κουνάκα μασιαμάρου, για κουσίνα μην να μου τουρισκαμήκαν.	6.141625
Chapter20_90_90.wav	ききんがちゃいったじゃっとく民義	2.1880625
Chapter20_91_91.wav	図団がシーンなりまな感じ	2.36325
Chapter20_93_93.wav	tukui aji ku na par aji a kuta menistente	3.4431875
Chapter20_95_95.wav	síná zátak rikugrinčig, íma ruraita usantig, hama urkupe ropaikona katicum, yura urmaikuna mantapas,	8.814
Chapter2_100_100.wav	Și mi-a facă mana canitiu!	1.9114375
Chapter2_102_102.wav	ta shwela taka kamba si miti sati siya na chu	2.5070625
Chapter2_103_103.wav	입맛다니, 흥기!	1.4599375
Chapter2_105_105.wav	Que us ha engat per call i metes a pejosen americans.	2.6906875
Chapter2_106_106.wav	Manakaspa ka, ni ambi, enkata piuampas, iu marizak, warmi kanka patszumunan.	4.939125
Chapter2_108_108.wav	Κουνανγα τίγρατσι, τίγρατσι, γυναίου αντιάρισκανικά.	3.110625
Chapter2_110_110.wav	빡다라!	0.894375
Chapter2_111_111.wav	یோ καتکமானہ پہ کریوں گیچ, ہویا ہوں گیچیوں!	3.0941875
Chapter2_112_112.wav	Mä kitaseka mana sinä satsa. Kasita mucki tisvämiväktaessa.	4.279875
Chapter2_113_113.wav	Pikahtari Singi, biwan kakahtari yachangi, kampakusam	4.7289375
Chapter2_114_114.wav	А ну и не ука мама, там я кайчу. Та-а-а-а-а-а-а!	3.4989375
Chapter2_115_115.wav	ما نقل لي ورمي كنه	1.7390625
Chapter2_116_116.wav	Amb la maca a un mon espacà, que gunava un començ a dir-hi.	3.468125
Chapter2_119_119.wav	παν்து மில்லகமிஞ்சை ரிகுனா் தாஞ்ச்சாம்மிஞ்சையாத்திஞ்சிஞ்சிஞ்சிஞ்சிஞ்சிஞ்சிஞ்சிஞ்சிஞ்சிஞ்சிஞ்சிஞ்சிஞ்சிஞ்சிஞ்சிஞ்சிஞ்சிஞ்சிஞ்சிஞ்சிஞ்சிஞ்சிஞ்சிஞ்சிஞ்சிஞ்சிஞ்சிஞ்சிஞ்சிஞ்சிஞ்சிஞ்சிஞ்சிஞ்சிஞ்சிஞ்சிஞ்சிஞ்சிஞ்சிஞ்சிஞ்சிஞ்சிஞ்சிஞ்சிஞ்சிஞ்சிஞ்சிஞ்சிஞ்சிஞ்சிஞ்சிஞ்சிஞ்சிஞ்சிஞ்சிஞ்சிஞ்சிஞ்சிஞ்சிஞ்சிஞ்சிஞ்சிஞ்சிஞ்சிஞ்சிஞ்சிஞ்சிஞ்சிஞ்சிஞ்சிஞ்சிஞ்சிஞ்சிஞ்சிஞ்சிஞ்சிஞ்சிஞ்சிஞ்ச	3.922875
Chapter2_11_11.wav	J.P. Meay. Finyan ako nakatin. Boy, tatin buon ako ning. Akot.	5.241125
Chapter2_120_120.wav	Runa con la maitapa y uyanahum, caigo y charica o sayon.	4.1785625
Chapter2_121_121.wav	kai aizuku na tarikuti	2.1548125
Chapter2_123_123.wav	Carcel sin apicosa	2.0656875
Chapter2_127_127.wav	и поцени, и поцени.	1.2618125
Chapter2_128_128.wav	かんがエウセビをパクチュリーにかけなちょう	2.6653125
Chapter2_12_12.wav	Manali Chumama	1.787
Chapter2_130_130.wav	Ah, ah! E mata-scaipi mas cangifredi!	3.744
Chapter2_131_131.wav	جي كنجي، كي نامي شوك تندنا نحوي بيكرقاني؟	2.5946875
Chapter2_133_133.wav	E a bom maizé na churra.	1.706875
Chapter2_136_136.wav	Jai paqueta, samofoni!	1.6616875
Chapter2_137_137.wav	今しなしちゃいとなくなったしなし、ウィジャチがあんたくなったマナチェリースパック。	4.605
Chapter2_138_138.wav	Αρυ, συναπάζα, αστάκα εμισόρα κουνάμικα ειδιά πιτήν.	6.2541875
Chapter2_140_140.wav	ali hujel kuna ka manatianjul	2.5038125
Chapter2_142_142.wav	So ujacij ant atarministinti, so eiziužiaktakunapa ujacij ant atarministinti,	5.02625
Chapter2_143_143.wav	수호야지간 닿다니 흥기	2.8490625
Chapter2_144_144.wav	Ari, su jau tigantat atsari pakat su visi atskunata zurai tausianti, to kui aizukunata žima tigapak.	7.7674375
Chapter2_145_145.wav	チェイピーパース、特殊な粉溜んだ、人間を持ち降りしか粉溜んだ、しまがっば。	4.5714375
Chapter2_146_146.wav	Αν, αλήγω, για να μην ρε κορυμφραιδί, σινάπας!	4.5421875
Chapter2_147_147.wav	И мът е тъх мочу ринчай пага!	2.2345
Chapter2_148_148.wav	Аска кульки вон ночу.	2.034625
Chapter2_149_149.wav	mana mana, uya chingapa antakunata san ni gapa ga mana ya pa kol kitama to rinjum	5.0898125
Chapter2_14_14.wav	Am a chutat cei cung imata pasne in capangunangii ce	2.946625
Chapter2_154_154.wav	Kim s-a cunit de oameni racuna micanti i-ma tapas ura-n gapa, m-a năhuntit.	4.278625
Chapter2_155_155.wav	Φρέδι! Νύνταγάλι προκίκτω μιουλιάρι!	3.31075
Chapter2_158_158.wav	Alica Tircanimi!	1.602375
Chapter2_159_159.wav	Mana ya cercanicu, wanprakunei masyina nya opama apanggata.	4.52275
Chapter2_160_160.wav	Пунгу вычащика капика у АТА ТИНАЗЯТАМИ МУТЁЛИ	4.901875
Chapter2_161_161.wav	Chai mandaniu kaka, ia na pa siami tuku sugo.	3.44025
Chapter2_164_164.wav	e mata!	0.547
Chapter2_165_165.wav	...siu hu cha chita, churanga pa mi siya muni.	2.3886875
Chapter2_166_166.wav	Pita! E mais patahuja, chinky!	2.4003125
Chapter2_168_168.wav	Que quinta page que se nele?	1.3901875
Chapter2_169_169.wav	Sinapas. E mais patahutia 5, paica, jancar, comare. Aizu com na pa, suctaita.	6.233125
Chapter2_16_16.wav	大なワチャリしかか、夜夜空き中。	2.450625
Chapter2_170_170.wav	O acipe já que diz que a manda. Rima e conauam, capar e conauam. O que tem que conauar já que diz que a manda?	7.456375
Chapter2_171_171.wav	W oktażka tażeku ciuaj?	1.4260625
Chapter2_172_172.wav	இமா தரி கூچچچچچچچچچچچچچچچچچچچچچچچچچچچچچچچچچچچچچچچچچچچچچچچچچچچچچچچچچچچچچچچچچچچچچچچچچچچچچچچچچچچچچچچچچچچچچچچچچچچچچچچچچچچچچچچچچچچچچچچچچچچچچچچچچچچچچچچچچچچچچچچچچچچچچچچچچچچچچچچچچچچچچچچچچچچچچچچچچچچچچچچچچچچچچچچچچچچچچچچچچچچچچچچچچچچچچچچچچچچچچچچچچچچچچچچچچچچچچچچچچچچچچچچچچچچچچچچچچچچچچچچچچچچچچچچچچچچچچچچچچچچچچچچچچچچچچچچچچچچچچچچچچچچچچچچچچچچچچچچچچچچچچچچچچچچچچچچچچچچچچچچچچچچچچچچچچچچچچچچچچچچچچچچچچچچچچچچچچچچچچچچچچچچچچچچچچچچچچچچچچچچچچچچچچچچچچچچچچچچچچچچچچچچچچچچچچچچچ	1.5333125
Chapter2_173_173.wav	Waktas kakunata?	1.2339375
Chapter2_174_174.wav	Kīgi zaktiskanenki nūka nīma lakta skata man arī kunicu.	3.452
Chapter2_175_175.wav	आजज़ लिवागा लिवागा जूज़ लिवागा जिवागा लिवागा लिवागा लिवागा लिवागा लिवागा लिवागा लिवागा लिवागा लिवागा लिवागा लिवागा लिवागा लिवागा लिवागा लिवागा लिवागा लिवागा लिवागा लिवागा लिवागा लिवागा लिवागा लिवागा लिवागा लिवागा लिवागा लिवागा लिवागा लिवागा लिवागा लिवागा लिवागा लिवागा लिवागा लिवागा लिवागा लिवागा लिवागा लिवागा लिवागा लिवागा लिवागा लिवागा लिव	4.411125
Chapter2_176_176.wav	マーナシナ感情、ニュカがキキンパンに仕方をやなかに、バイパタバスをやなかに。	5.8989375
Chapter2_177_177.wav	お渡したくなったりこっちはい	1.8765625
Chapter2_178_178.wav	tu kui kuna misina ja takangi ti	2.20225
Chapter2_179_179.wav	ki kim bajwata grunami kangi yuiachin.	3.030875
Chapter2_17_17.wav	Aukavija Tiriska Kamana Makana, Jui Pihuayuncho	3.9105625
Chapter2_180_180.wav	バックタイらしみくな	1.5430625
Chapter2_181_181.wav	Κι κοιντάρα, βιτσες, μπασάκι, μάρα!	1.9435
Chapter2_182_182.wav	É mata nirumiari.	1.6189375
Chapter2_183_183.wav	que no ha de fer pura seta mi canguit.	2.6956875
Chapter2_184_184.wav	Муспания, гангитчик!	1.899375
Chapter2_185_185.wav	Nie uka pa pa czakuna to cinga cinga pa, my siamy szkanie.	3.15725
Chapter2_186_186.wav	Mananina kunata nigus kanki, manamuna sa kunata uyan!	3.4635
Chapter2_187_187.wav	엄마, 이마만 nicho는 게 떼, 아니?	1.8610625
Chapter2_188_188.wav	De passo!	0.764125
Chapter2_189_189.wav	Востоянься, миза, с ним манда, битя и токуренки.	2.5815
Chapter2_18_18.wav	Quis pitilhar, warmi alca.	2.14475
Chapter2_19_19.wav	Dima paise au kawar mi, mananis pa ka zima paise iari.	3.8289375
Chapter2_21_21.wav	e matarrurangapag.	1.5978125
Chapter2_22_22.wav	آیجو یک تاپی شیمی سا پاکاو سا کناما آیلی کائی تا ریکو چی کناما	5.152625
Chapter2_23_23.wav	Sinaka yang gaya-caya rindu rastu kurangkin.	2.7354375
Chapter2_25_25.wav	நானான் மானாய்யாங்கமான்	1.812
Chapter2_28_28.wav	Já me enganhou!	1.77475
Chapter2_29_29.wav	開啟開啟	0.9235
Chapter2_30_30.wav	आपीपापी पापी पापी पापी पापी पापी पापी पापी पापी पापी पापी पापी पापी पापी पापी पापी पापी पापी पापी पापी पापी पापी पापी पापी	1.61825
Chapter2_31_31.wav	Nie, nie, nie, nie, nie, nie, nie, nie, nie, nie, nie, nie, nie, nie, nie, nie, nie, nie, nie, nie, nie, nie, nie, nie, nie, nie, nie, nie, nie, nie, nie, nie, nie, nie, nie, nie, nie, nie, nie, nie, nie, nie, nie, nie, nie, nie, nie, nie, nie, nie, nie, nie, nie, nie, nie, nie, nie, nie, nie, nie, nie, nie, nie, nie, nie, nie, nie, nie, nie, nie, nie, nie, nie, nie, nie, nie, nie, nie, nie, nie, nie, nie, nie, nie, nie, nie, nie, nie, nie, nie, nie, nie, nie, nie, nie, nie, nie, nie, nie, nie, nie, nie, nie, nie, nie, nie, nie, nie, nie, nie, nie, nie, nie, nie, nie, nie, nie, nie, nie, nie, nie, nie, nie, nie, nie, nie, nie, nie, nie, nie, nie, nie, nie, nie, nie, nie, nie, nie, nie, nie, nie, nie, nie, nie, nie, nie, nie, nie, nie, nie, nie, nie, nie, nie, nie, nie, nie, nie, nie, nie, nie, nie, nie, nie, nie, nie, nie, nie, nie, nie, nie, nie, nie, nie, nie, nie, nie, nie, nie, nie, nie, nie, nie, nie, nie, nie, nie, nie, nie, nie, nie, nie, nie, nie, nie, nie, nie, nie, nie, nie, nie, nie, nie, nie, nie, nie, nie, nie, nie, nie, nie, nie, nie, nie, nie, nie, nie, nie, nie, nie, nie, nie,	1.0624375
Chapter2_34_34.wav	Iarna, Iarna, ca un, mi-seguar mi-mi ca.	3.4105625
Chapter2_35_35.wav	Paitaqa manna nyukakafinya niya viwan kuskaniju	5.0015
Chapter2_37_37.wav	омата, нiau вита хауа пِчурашпа, ρِхум.	3.6454375
Chapter2_41_41.wav	Chating itchoo	1.122375
Chapter2_42_42.wav	Arri, masata monangi!	2.0614375
Chapter2_43_43.wav	Ma zna, ce arise catta!	1.544
Chapter2_44_44.wav	Tu cuite a pagrine!	1.5929375
Chapter2_45_45.wav	Κι σπίτσι η ίδια τα πουημάντα μας η.	3.0311875
Chapter2_46_46.wav	今、パッサイスチャーとおこいたかも何?	3.06625
Chapter2_48_48.wav	पजानी पजानी	1.577125
Chapter2_51_51.wav	오야, 오야.	1.22725
Chapter2_54_54.wav	Adi, Adi!	0.77475
Chapter2_55_55.wav	Să moite, pici arina vanga cu nata niană cerinicio, si napas ce e răze pază scatumăticul nata cerinii.	7.9591875
Chapter2_57_57.wav	Мана, никакая мама, тяю вам по гляницу.	3.14125
Chapter2_59_59.wav	¡Sus! ¡Ochise, San Calconata! ¡Apamón, Chifu!	3.0318125
Chapter2_61_61.wav	E nu ca ca nimata n-aric unata ce ariniciu.	2.6225
Chapter2_62_62.wav	کی Geemikha, then bring it.	1.6046875
Chapter2_63_63.wav	今た人気?	1.2646875
Chapter2_64_64.wav	چاوپی کی گیبا چاوپی نیو کنشیبا	2.5356875
Chapter2_65_65.wav	E mata-neu, Anki!	1.4005625
Chapter2_66_66.wav	Se hay por evacuna taca hospital pisa mi cum.	2.740125
Chapter2_67_67.wav	新的一样	1.589125
Chapter2_68_68.wav	கרامди கרے	1.263
Chapter2_69_69.wav	Nihanna ti alju	1.1761875
Chapter2_71_71.wav	かいた	0.9659375
Chapter2_72_72.wav	カットグリーンチーマーシー	1.810125
Chapter2_73_73.wav	आज जो परेंगाशा परें लगाशा बरें	1.82125
Chapter2_74_74.wav	Ки-кин, пацах-хатушба, чунка-пичаха-хабинг!	4.2705
Chapter2_75_75.wav	To cuidando o pazaco.	1.400125
Chapter2_76_76.wav	أم أم أم أم أم أم أم أم أم أم أم أم أم أم أم أم أم أم أم أم أم أم أم أم أم أم أم أم أم أم أم أم أم أم أم أم أم أم أم أم أم أم أم أم أم أم أم أم أم أم أم أم أم أم أم أم أم أم أم أم أم أم أم أم أم أم أم أم أم أم أم أم أم أم أم أم أم أم أم أم أم أم أم أم أم أم أم أم أم أم أم أم أم أم أم أم أم أم أم أم أم أم أم أم أم أم أم أم أم أم أم أم أم أم أم أم أم أم أم أم أم أم أم أم أم أم أم أم أم أم أم أم أم أم أم أم أم أم أم أم أم أم أم أم أم أم أم أم أم أم أم أم أم أم أم أم أم أم أم أم أم أم أم أم أم أم أم أم أم أم أم أم أم أم أم أم أم أم أم أم أم أم أم أم أم أم أم أم أم أم أم أم أم أم أم أم أم أم أم أم أم أم أم أم أم أم أم أم أم أم أم أم أم أم أم أم أم أم أم أم أم أم	2.1258125
Chapter2_80_80.wav	Niamis atteriskią kangi masiką.	2.21275
Chapter2_82_82.wav	Нюка Рикс и машины!	1.6885625
Chapter2_85_85.wav	アレリンギー	1.2090625
Chapter2_88_88.wav	Ya, ma'ka i te rura, waiti, tu!	2.8275625
Chapter2_89_89.wav	Mană, pita, pasă, chicii!	2.116625
Chapter2_8_8.wav	Czajta na mandajata muzpanii.	2.4970625
Chapter2_90_90.wav	BUNES PASA NIACU!	1.7964375
Chapter2_91_91.wav	Se naca o pasago, tchau, bichou, bio e arenda!	3.0118125
Chapter2_93_93.wav	Nis pakai apoluniu pagormi!	2.3173125
Chapter2_94_94.wav	Jai kapa riku tau yang gitu?	2.0535
Chapter2_95_95.wav	Niu katakapi pasmanakai askaciu, siinapas učiažiačiai grini.	5.1216875
Chapter2_96_96.wav	Сюьяйте, Сюьяйте, Машикон!	2.0550625
Chapter2_97_97.wav	Manaju pengganai yang...	1.6223125
Chapter2_9_9.wav	Άρι, σινάνιχου τσατήσκα φανγάκα.	2.7539375
Chapter3_101_101.wav	Na, imata ce, nii n-am mulțurit camii! Al stau oanga ca ii pandemia pe chape!	5.4181875
Chapter3_102_102.wav	Nipangi! Kayu ya tiga antakunata ya cahaya cikun apa ga Ali pacami ke ring?	4.9208125
Chapter3_104_104.wav	y masina te ha visto almente de achar jugarringari	2.355625
Chapter3_106_106.wav	Uyati antatak cairing	2.3779375
Chapter3_107_107.wav	Oya juga tapi ya cahaya cita o seancik.	2.577875
Chapter3_109_109.wav	Kunaṅga, niṅṅga, litami, rūrana, kanti, ama, pipa, zimanā kuchu.	5.546875
Chapter3_116_116.wav	Ce euta ca ma pineti cu?	1.4443125
Chapter3_117_117.wav	Ναι, μη τέντα να χωσπασε μάσιο.	1.679
Chapter3_11_11.wav	Aarī ni İkpi Mananīpi	2.2849375
Chapter3_120_120.wav	χιπα μαζί κουσπάρα, ζεις όμως είχε να τακά.	2.289375
Chapter3_122_122.wav	Sinakan niway, mai pita goya cigan tata cura kringgici.	4.3109375
Chapter3_126_126.wav	Ari, närri kohunikosisaketta.	2.7395625
Chapter3_12_12.wav	Семойте, Семойте!	1.7609375
Chapter3_131_131.wav	கமچی کا پگمی, مانا கமچیспاکہ, چیگگا چیریں گا می	4.1695625
Chapter3_132_132.wav	J'ai congutu!	0.7758125
Chapter3_133_133.wav	Jai kunatami uyaji antapa uyaji nakanchi, tu kuiya jaju	4.5801875
Chapter3_135_135.wav	しなか	1.5748125
Chapter3_137_137.wav	Είματα χτώπω μου, είματα χτώκω σκά.	2.127375
Chapter3_139_139.wav	Çeywonbara imap ayırap izlikşişka.	3.133125
Chapter3_141_141.wav	روكو سلور كناوان، ماي في فجوار كوريش بمسكناحون، جيشة جويتة شسكين جاپا	6.655375
Chapter3_142_142.wav	Asta oamnumra cu neurman gamii!	2.111625
Chapter3_143_143.wav	Cea e taca azi din amicantiu!	2.0195
Chapter3_146_146.wav	ยาจจะหุง หามุกตัง!	1.9951875
Chapter3_147_147.wav	Si napas ii mata cuncun cantis o atata cari o va conaca pus a goatata cari o va conaca	6.7621875
Chapter3_148_148.wav	Pour jamais, n'arrêtez pas.	1.461875
Chapter3_149_149.wav	コナンガ、海景ロマンターオルマシカッパシ	2.6418125
Chapter3_14_14.wav	چای تا شاموحو, مَا پَمَا پَبِرَا جُنَّا چُرا کُنَاون	4.1589375
Chapter3_150_150.wav	Cajimanta taukatai tamamakona jačiaimantainspektoruan riemangapag maniaška.	5.76
Chapter3_151_151.wav	Nukapasimita sa tegrinim.	2.2116875
Chapter3_152_152.wav	Aseto suje, aseto suje!	1.7146875
Chapter3_153_153.wav	Καίπικα του κουηκούνα μη σημήτακλη παρής παραίσπαια είκουν. Αλπκόλτα με εκεί πειτσουράρες παπας.	5.0998125
Chapter3_154_154.wav	新鮮な新鮮なアリミ	1.552375
Chapter3_156_156.wav	Sínapáys, pithek csajman gógy a csulni iska.	2.606625
Chapter3_157_157.wav	Manau paizat și inspector.	1.7645625
Chapter3_158_158.wav	Tokawak nak minum mampu untuk ikan ia takutnya jaskin gapak.	4.3431875
Chapter3_15_15.wav	Puság! Pittajari! Hat, tudom, mizájtok, Puság!	3.408375
Chapter3_161_161.wav	Pandemia Commission has announced its inspector.	2.9266875
Chapter3_162_162.wav	Sinapas asytau manjanai pasti yangmi.	3.3668125
Chapter3_163_163.wav	今し?	0.9416875
Chapter3_164_164.wav	MANA YACHAY!	1.4613125
Chapter3_167_167.wav	Cześć papas! Ci kandzami!	1.9274375
Chapter3_169_169.wav	ニーナンじゃキミかん	1.889125
Chapter3_16_16.wav	Kiekim pawarmi musba, nia viimana pinka niuarka.	3.73575
Chapter3_170_170.wav	Show what I'm doing, risk show what I'm doing.	2.2946875
Chapter3_172_172.wav	Esta wanga, o oopora mana recorre, mana pucjang, mana rimarim.	6.452625
Chapter3_173_173.wav	In spector, ca ii cam anasina cati gushancio.	3.0905
Chapter3_174_174.wav	ききんばぎでいかなわん、よかったしなじゃたみよ、やに	3.3409375
Chapter3_175_175.wav	Si na paź i ma ta tarzu zacielmonenki ci.	2.66125
Chapter3_176_176.wav	И аче на уасекона паскари че, ова конна и аче кои ма тигра че?	4.6816875
Chapter3_177_177.wav	Ma si conaua in topareciu, puc, ziatiu, asici un bajari, n-ati usinat.	4.5824375
Chapter3_178_178.wav	Ωγγου είχα πειτωκούς πακά.	1.5675
Chapter3_179_179.wav	Úngonataka, Úshangajami, Kaisina, antalakunapi wa simantigraspa.	5.5503125
Chapter3_17_17.wav	Sinari mahu mana sa ki chatyo	2.6421875
Chapter3_180_180.wav	Ya sana wasikona paskaripika ki kimbawa kunata kachamungi chimanja?	4.8829375
Chapter3_181_181.wav	Aadi!	0.7685
Chapter3_182_182.wav	Sinépas, amanana la ikona, Japichong, tu cuita recorriana.	4.1416875
Chapter3_185_185.wav	Hat tumpam bakunapi pūg zanahotiu.	2.800875
Chapter3_186_186.wav	kanja kunapipori na hochungari	2.4721875
Chapter3_187_187.wav	Tokui yacha cikonami yacha hushka kana, si na zatak bakonari skapa shikana.	5.326
Chapter3_188_188.wav	Ali Paca!	0.8615625
Chapter3_189_189.wav	しなかちゃいたらおらしいんだ	1.6701875
Chapter3_18_18.wav	Manapinga, muzpańabi!	2.9775625
Chapter3_190_190.wav	Ži náši náši náši náši náši náši náši náši náši náši náši náši náši náši náši náši náši náši náši náši náši náši náši náši náši náši náši náši náši náši náši náši náši náši náši náši náši náši náši náši náši náši náši náši náši náši náši náši náši náši náši náši náši náši náši náši náši náši náši náši náši náši náši náši náši náši náši náši náši náši náši náši náši náši náši náši náši náši náši náši náši náši náši náši náši náši náši náši náši náši náši náši náši náši náši náši náši náši náši náši náši náši náši náši náši náši náši náši náši náši n	4.1033125
Chapter3_191_191.wav	아름긴 기추	1.1046875
Chapter3_192_192.wav	Imadur anak kunata kacagrini.	1.9425625
Chapter3_193_193.wav	شو فنگا پکل کچشا	1.674375
Chapter3_194_194.wav	جاکی کنکہ تیگرامی,شنکہ کی کنگوں نپا ہوا	3.2219375
Chapter3_19_19.wav	I mataczej!	1.108875
Chapter3_20_20.wav	Muspaniawi!	1.19275
Chapter3_23_23.wav	Jo que m'està com a enjarís que has catecat i ho he arringut jo. Ho hem iconec, veig una papunja t'acharinga. Qui ja me m'amanda? Se' hi t'acallat xingui.	10.134375
Chapter3_24_24.wav	Pai ca a chicit a chutat singa pe samurca!	2.2399375
Chapter3_25_25.wav	Makaska Nispa, chucha cińka pa!	2.45125
Chapter3_26_26.wav	まっかしかにんぎ	1.9349375
Chapter3_27_27.wav	Nukata, iya pas ahu yas kanis bahu cahu cahu tak cura nazami.	4.3003125
Chapter3_29_29.wav	wari mi gota ka huyes pamichari na kanchik	2.758
Chapter3_32_32.wav	Pita González-Kang	1.3109375
Chapter3_33_33.wav	Kainds jūk sikpi, sūkjeikus pa kausakta misinanin.	3.841875
Chapter3_34_34.wav	ja egin gitsu. Heikulki gota hapibai. Kaiwan ga kamba miski ja kuguta zandingu.	5.6468125
Chapter3_36_36.wav	Bună punjaja s-a curinit, ce-i răcu armită că a căcerici!	3.6605625
Chapter3_37_37.wav	Mastago?	1.030375
Chapter3_38_38.wav	e o caurpigo.	1.5008125
Chapter3_39_39.wav	Κι σπητύωε, κι σπητύωε!	1.980625
Chapter3_3_3.wav	محمد ان ما نحن لتعيير	1.8555
Chapter3_40_40.wav	Νιούκα μη μανάλει κονατασύντα χυσκανή.	2.2080625
Chapter3_41_41.wav	نقف أوشيgu مندخ	1.5701875
Chapter3_42_42.wav	Hüseyin.	1.6135625
Chapter3_43_43.wav	Нюка коняно, сина, кассачу.	1.6879375
Chapter3_44_44.wav	O assimantigrammi, ma scinago gashpa.	3.0890625
Chapter3_45_45.wav	Si nata-s cu tinga manata-gma ca o angi cu!	3.8140625
Chapter3_46_46.wav	A mapeiteira, muzpa niave ninguitio.	3.00025
Chapter3_47_47.wav	Can de pas.	1.070875
Chapter3_48_48.wav	Τι μπαφουραξα, τι μπαφουραξα, ο αλλημικά!	2.8893125
Chapter3_49_49.wav	Pikani yang gisaya	1.0731875
Chapter3_4_4.wav	Dipacho!	0.8281875
Chapter3_50_50.wav	Ca dit à quoi? Ou à si bien bien ça me dit qu'on gagne?	2.536875
Chapter3_51_51.wav	que en d'acabes sumat, sumat, m'acabes, famí? Tu cuita, vas m'anjar a t'hi ser!	4.5701875
Chapter3_52_52.wav	Pittēchamuktā gici, ka eikau saitāk.	3.1546875
Chapter3_55_55.wav	しなきゃしこながまんじゃなちょう	2.4584375
Chapter3_56_56.wav	εی ماشینانیم, مейχан χαری, χαری, αλیسکا, καیταکا, ما να پتھαγوата, τα καوσейта, وشنگا چکک.	7.60675
Chapter3_57_57.wav	Maifang warmi pas manna tuh kuiwata kunata maka itu kuija kau sanggachu.	4.94225
Chapter3_58_58.wav	Runa kunapas shai humi, mana imatta sinetukui manta, tukui pa cha hui cha riska kaspaka.	6.5775625
Chapter3_59_59.wav	وووه كنانك إما بنجا تحقان	2.9929375
Chapter3_5_5.wav	Пусть вся миза, если не манда обидеть то, что он.	2.5159375
Chapter3_60_60.wav	Awakey	1.0178125
Chapter3_61_61.wav	Awaki nacikainakarka.	2.419125
Chapter3_63_63.wav	Dupui punja kuna awakikang.	2.2266875
Chapter3_64_64.wav	Tu cu punjacuna cei si na jatacang.	2.756625
Chapter3_65_65.wav	ca ișinege ca usanata mana munanitu.	3.5789375
Chapter3_66_66.wav	Manama Shikunada Charini	2.029125
Chapter3_67_67.wav	Manamai menjük, síté úzani.	2.15175
Chapter3_68_68.wav	Aici ca și ai cus ca micăni.	2.18125
Chapter3_69_69.wav	Вауа! Жина пъзню кака и маху чатато хчарени!	3.9615
Chapter3_6_6.wav	ہوچہ چینگا پر اسپاکہ پائی رہوچہ چی تو کش پایوکشی اسکہ	3.9304375
Chapter3_70_70.wav	Νημάτα, κοικίπας, νιπίπας. Σα η μάνατα φυνιαρινή. Πιτάπας, μάναχουτσιωτσιτα. Ουσάσπα.	7.2358125
Chapter3_71_71.wav	Μαναπί τάπας, μάκαι τεουσανι.	2.4303125
Chapter3_72_72.wav	Cajatung muy guang, ni amana o sanicho.	3.3008125
Chapter3_75_75.wav	Idy.	0.5844375
Chapter3_76_76.wav	이만오지구나, 다채린기, 유건치파, 아이석구나파, 오야, 지간다, 맘다	3.9915
Chapter3_78_78.wav	Y más todavía ringari.	1.1295625
Chapter3_7_7.wav	Mana ya canti imas pa, sinapas, cari menggerirkan ci, ima kasih kata, oya ga payari.	5.55575
Chapter3_82_82.wav	And that's that.	1.0863125
Chapter3_84_84.wav	Συνάπας!	0.6598125
Chapter3_86_86.wav	Καίκουνα μάγκα, ελάδε ρόπα, χάνβανά, πες μάνα ο ακανισ...	3.8240625
Chapter3_87_87.wav	Si n-apas cei ca cei ca?	1.734875
Chapter3_89_89.wav	Si naga ima katygring gitu.	1.612
Chapter3_92_92.wav	Pai kuna namuna imanda, zuna kuna amazimachiung muna, zuna kuna amazimanda ya cha huchu.	7.60975
Chapter3_93_93.wav	Τσαϊ κανάλι πατσα μαζια κοιμάρι!	2.3049375
Chapter3_94_94.wav	ちゃいかにま!	1.11275
