file	transcription	duration
Chapter3_96_96.wav	Nyun kataita nirka. Kisbitita manyan na manaki spirita manyan.	4.9865
Chapter3_97_97.wav	Часно по тяме, часно по тяме.	1.850875
Chapter3_99_99.wav	Sinha Paz ki King Hunata Yana Pagri Mi Aijul Jaktapag Uya Chik Antachari Chul	5.9045625
Chapter4_100_100.wav	Ama, Ama Pandari Sancho, Kaion Goikuna, Ka Pachamamata, Toku Chikushka, Manta Misamo.	7.4033125
Chapter4_101_101.wav	ニョコンチーに、ヨーラコナータ、サチャコナータ、トクチコンチー	5.4531875
Chapter4_102_102.wav	Mai ta puris papis, ma payacinciich, mai ta rispapis, ma payacinciichai paça mamata.	7.4829375
Chapter4_104_104.wav	Τα είμαντά μη καη μάνα ρυξής καλή ο ακόναν, νηκουντήχτα ομγωτής πακάτήκου.	6.762
Chapter4_106_106.wav	Nukaka, nukaka, sinnakan yani mi?	2.709
Chapter4_107_107.wav	νیو کنچی ہم بگوашی کا ہنداشکہ...	3.796
Chapter4_109_109.wav	hámbi kuna tutapas punjapas tut kui pa cha kuna jam kanaku	4.7419375
Chapter4_113_113.wav	Chahrin Ching, Rikugrinni Anchakunatta Rikuna Ukupe, Ishkaya Samarinati Anga,	6.671625
Chapter4_114_114.wav	Sinapis, kunanką vairata aizsana palmi iliašką.	4.1516875
Chapter4_115_115.wav	ویرا تا ایساکہ سارும کیляکونپی وگلیشکا کرکا, ککی کمہ آلگی چنگапاگ مانا شامشکاچی	7.926125
Chapter4_116_116.wav	Kuting-kutingmi markapusakta manyeskanci, si napa ni mata mana ruranci?	6.0433125
Chapter4_119_119.wav	Runa kuna pakhali kausaita riku hu milia i runa kuna taka, witskana wasipi witskati shpacura nakanga.	9.0314375
Chapter4_126_126.wav	Šiu gmiski niau į jūrą gruną. Cajai, cai! Paimi karka!	5.401875
Chapter4_12_12.wav	Mahanam, Mahanabuşa!	2.4103125
Chapter4_131_131.wav	Čaupi paiku napak Čaupi niu kapa, nispa!	4.007125
Chapter4_132_132.wav	Chai wa punizka na habitizka ka pika bichashu ni shpami maskanakun.	5.563125
Chapter4_133_133.wav	Нюка я тебя не пикакт	1.6239375
Chapter4_135_135.wav	وانیشکا کنапag zagta mankacag mankarka.	3.7156875
Chapter4_136_136.wav	Rikosun warmi, keginga mana ruranata mirulah skanggi. Cahit suawah marah kuna khutca kak pipas,	7.312875
Chapter4_137_137.wav	Si napa sikit kingga niami paia jauh kandiki?	3.0775625
Chapter4_138_138.wav	Bici aș pasat că își păcă i-mi atât ariziu.	2.7739375
Chapter4_139_139.wav	Ah, really?	1.0485
Chapter4_13_13.wav	Ари, Нюкака, Нюкака!	2.2619375
Chapter4_140_140.wav	cari manda syuk tu kui watata tu kui kuan Amanda jangka gringgi	4.141625
Chapter4_144_144.wav	kekin terbunat ya canggit	1.8045625
Chapter4_146_146.wav	Kekingnya cadangkang itu, daripada pembata rura.	2.6618125
Chapter4_148_148.wav	Αμάρει ενδίπηρή με βοήτσο, ας τα καμμούς πάμικες κανεί.	4.000375
Chapter4_14_14.wav	Вакай-вакай!	0.999875
Chapter4_150_150.wav	چاہیت تا کیکی رونا گریں گی	1.9676875
Chapter4_151_151.wav	Kekingian apagreng gini masih kunapa ucija pambakun apitar punawang.	4.65425
Chapter4_153_153.wav	Kaisuk Ćūsku pačakunata, ki kim bakhatuna ukupi, imata pačkaituji.	5.473
Chapter4_16_16.wav	Giquem aze o arme! Tu cuimanta a fuiasca o arme! Caita ruta honqui!	4.96025
Chapter4_18_18.wav	Cei mai mântă, ce arii oambră cu ne-amaniă o arca!	3.62775
Chapter4_19_19.wav	Пу-ка-ну-ту-пи-пу-ли-кур-ка!	2.584125
Chapter4_21_21.wav	O arme caimanta, o chate do cunque!	3.0746875
Chapter4_22_22.wav	Δεν οικαίκανε μη, σινάπας, είματά τα γρουρα ηγουσαίμαν καρκάνη.	5.056
Chapter4_23_23.wav	Ameni n-a sa-wa-l ca! O-a apag magita-si-na-i ca-i na-a cu-o-l ca!	4.2713125
Chapter4_29_29.wav	Se igual ligo a embraque un name ormaterial.	3.1915
Chapter4_2_2.wav	Ashita ka kijakuna hipa, ya janawa si kuna paskari shikamanta	4.4328125
Chapter4_30_30.wav	Νιωκά, νιωκά ρίχσινι, σου χειρακζια γουάμπρα, το κοίπατσια πιμότω πιμποριν. Μαν να άλλη ρωρέκουν να τα συνάσπα ποριν.	8.58575
Chapter4_32_32.wav	Kaip pačia kuna pirą, žyakipi urmasi ka. Ulyacin antą ta kasiaritin gapag, čiai maris jau pirą, kas na žyakia paška.	8.8306875
Chapter4_33_33.wav	Ari, Ari, o Ari enjum!	2.6441875
Chapter4_34_34.wav	சنپس, 샤муچ, 샤муچ, کلکہ نیامی کجریل	3.7849375
Chapter4_35_35.wav	پوٹィング یارینجم ماشکونا کناگا رہی میپی میگانچی	4.9404375
Chapter4_36_36.wav	Kaila imipika wa kima sikuna oya tigan tapimikan wa kinguna ka wa si manda oya na hun	5.8444375
Chapter4_37_37.wav	Nukaan tiwaya ti antata Kazarici pacapi kapanchi.	3.265
Chapter4_38_38.wav	А ли самусь как опойте? Майпик, аспапас, кояте им пойти!	4.4400625
Chapter4_39_39.wav	மیکن سمسکا کنا نکا یا لی پائچی, لی پائچی, ماشی او کنام	3.2408125
Chapter4_3_3.wav	Leonormasipas, Cahikirumanta, Ormas Kawa Pemama, Nenangku Sijami Karka.	6.0193125
Chapter4_45_45.wav	Nenang tami puris kakai oya tiang tata taringap.	3.3755
Chapter4_4_4.wav	wawat tak kakak fakesk kecekita inyi sesaka, jay hi pakak yg jana wacima rita usarkan jami	6.2151875
Chapter4_53_53.wav	Sinea, păstiupta, puita cerimi!	2.151625
Chapter4_54_54.wav	おやちがんたか、今出たかぐり	3.0275
Chapter4_56_56.wav	Не забудь, и машина с утти с ката уезжать гринцы.	3.330625
Chapter4_57_57.wav	Nukantik өз'yak tapi өsuk tapi өkuna өраркantik.	4.2820625
Chapter4_58_58.wav	Tuku ikun asyutita, Arzaskan Mikangmi.	2.8674375
Chapter4_59_59.wav	Сума каусай!	1.6155625
Chapter4_5_5.wav	しなかチェイカーききんごなパハワー、アリニングチーチョウ。	3.139875
Chapter4_60_60.wav	Alima	0.8415
Chapter4_61_61.wav	Ari! Suomakausai ujati antaa!	3.2423125
Chapter4_62_62.wav	Ži, Ži, Ži, Ži, Ži, Ži, Ži, Ži, Ži, Ži, Ži, Ži, Ži, Ži, Ži, Ži, Ži, Ži, Ži, Ži, Ži, Ži, Ži, Ži, Ži, Ži, Ži, Ži, Ži, Ži, Ži, Ži, Ži, Ži, Ži, Ži, Ži, Ži, Ži, Ži, Ži, Ži, Ži, Ži, Ži, Ži, Ži, Ži, Ži, Ži, Ži, Ži, Ži, Ži, Ži, Ži, Ži, Ži, Ži, Ži, Ži, Ži, Ži, Ži, Ži, Ži, Ži, Ži, Ži, Ži, Ži, Ži, Ži, Ži, Ži, Ži, Ži, Ži, Ži, Ži, Ži, Ži, Ži, Ži, Ži, Ži, Ži, Ži, Ži, Ži, Ži, Ži, Ži, Ži, Ži, Ži, Ži, Ži, Ži, Ži, Ži, Ži, Ži, Ži, Ži, Ži, Ži, Ži, Ži, Ži, Ži,	9.406375
Chapter4_63_63.wav	Cunanca zici pas a cinci, suma causa uiati in antar. Cunanca zici pas a cinci.	6.74625
Chapter4_64_64.wav	數碼告稅無邀請按大數帝王	2.861625
Chapter4_67_67.wav	ニョカンジースを上げてみましょう。	2.9341875
Chapter4_68_68.wav	美味しい美味しいやかにキキングナウンかしキャマンだ	2.7209375
Chapter4_69_69.wav	Συνάπας ασιαγού τα μαντιαχωνίμη.	2.5548125
Chapter4_70_70.wav	Нюка, команда, Кайта Жужащик, Нитю.	2.34325
Chapter4_71_71.wav	新的吧 改變美根基 或亞洲人的國人基	4.1360625
Chapter4_74_74.wav	ご視聴ありがとうございました	1.1989375
Chapter4_75_75.wav	Nyu Gakayuya Nimi, ajujakta pa uyachi antakakami, jaakta kunapasi misinami.	6.201875
Chapter4_77_77.wav	Kaimanda na paikunata aizuku na manka čiangici, Žeki kunata vižia či, taki kunata pažma nieito o šiangici.	8.2265625
Chapter4_80_80.wav	かいをやちやんとか、ききんごなパンにかく	3.2036875
Chapter4_82_82.wav	Handi!	0.8491875
Chapter4_84_84.wav	மاناالی مسکوشینا میکارک	2.5110625
Chapter4_85_85.wav	Кто-то уйдет, он-то уйдет.	2.35525
Chapter4_86_86.wav	Jāpāžu paikunāvang rapidu koska, ujovand sama ižarispa, hambi guasi mangžinkarka.	6.904125
Chapter4_87_87.wav	Ο Ακκινγόνα τσαίπηζάτα σηταρισπαγόνιω να χώρκα.	3.5164375
Chapter4_88_88.wav	Orma spaja çay pisa kiringarık.	2.8489375
Chapter4_89_89.wav	Vanius kakuna tapas man na tandači, o siarindžiukar.	4.0139375
Chapter4_90_90.wav	Я напомню, как ты не украдь, а я не украдь.	3.8035
Chapter4_93_93.wav	τுکுی پچھα کنپی, τுکுی μάமہ جاکτα کنپی, وانیوسکا کنپتکہ, اُششاشکا, اُشاشکا, میراری نہ ہوبта میری کورکانچی.	8.223375
Chapter4_95_95.wav	Peipadrurei cu n-amantac, guarangă, guarangă cu n-au anircă.	4.030375
Chapter5_100_100.wav	Naju Cahiman datang di Sama Huta Oyang Gigi	2.7626875
Chapter5_101_101.wav	Gua minci gua si manda siamuhu.	2.15725
Chapter5_102_102.wav	Уетч! Уетч!	1.0156875
Chapter5_104_104.wav	ふっ、ティンジャー!	0.8254375
Chapter5_106_106.wav	Čaikunataka, čau pitu tapi zyúxi, supajpa zmanali cinju.	4.952125
Chapter5_107_107.wav	マンマンなさきぐりにつく	2.0301875
Chapter5_110_110.wav	今しばっ	0.8004375
Chapter5_112_112.wav	my	0.442125
Chapter5_113_113.wav	Człogu tajami mólanki.	1.8829375
Chapter5_114_114.wav	スーッ 受けた	1.102875
Chapter5_115_115.wav	シュッ!おほほほ!った!	1.4931875
Chapter5_116_116.wav	Uchuchu, to już mi mój naci.	1.72725
Chapter5_117_117.wav	Järlekongi!	1.4258125
Chapter5_118_118.wav	Ujej! Kojca! Aż ci czukanki!	2.5645
Chapter5_119_119.wav	Anda, guse!	1.205125
Chapter5_121_121.wav	온프시켜줄게, 안기!	1.3403125
Chapter5_124_124.wav	Tango un'apa che ho semanda calpeici!	2.03175
Chapter5_125_125.wav	キッキングのジックスがかりにちまい	2.1728125
Chapter5_126_126.wav	Žai mipekas, kaikuną kaip pažbažiu ksirkai!	2.877875
Chapter5_127_127.wav	І ми познали, а я та ж ікуськашно?	2.269875
Chapter5_129_129.wav	Суварми ухусь пока на тоже монерка.	2.931625
Chapter5_130_130.wav	கை,ுyயா, چی, அنتمان்டா,ும்பرا, کு,னپا, یکا,ا,یپا,چھا, میکرکா	4.4369375
Chapter5_131_131.wav	Ali kausai ujāti antepika, tūkų imiās ir įchun.	3.5853125
Chapter5_132_132.wav	Astau în ui a cunat așa ring.	2.49275
Chapter5_133_133.wav	Masipura na paikonata kachanahu	2.4505
Chapter5_134_134.wav	Huya riska kunapa-sitaki kunapa-sitaki, makanya nafom.	2.79975
Chapter5_135_135.wav	Si nažiata ažiužiaktapika į manalitiaši kaikonata bija nga pakai yana hun.	5.3264375
Chapter5_136_136.wav	Aš apacėkų napija, ujatėjantą ka maskariją kuna taip žėlį motų rīškami karė.	6.65275
Chapter5_138_138.wav	今なじゃん	1.129875
Chapter5_139_139.wav	今ないじゃ	0.8458125
Chapter5_143_143.wav	Kaipi minkan į matapas ruras, aš pamiša muskai.	3.8549375
Chapter5_144_144.wav	No, no, no. I m'empas anar a païta que xangar paningitxo?	3.298625
Chapter5_147_147.wav	كيف كي جانكي مندكا مانكككي تحاقين تيجيو	3.176625
Chapter5_148_148.wav	Шинака!	0.8521875
Chapter5_149_149.wav	Arya, rica ita keiachanimi	2.1251875
Chapter5_151_151.wav	今に行けた	1.0358125
Chapter5_152_152.wav	Imacha!	0.9373125
Chapter5_153_153.wav	ニュカカマナやっちゃにキチキタク	2.3140625
Chapter5_157_157.wav	Chamou!	0.902
Chapter5_15_15.wav	Νιουκάντσι, μικού να κουνάτα τέρπου, οι οσαντσιμι!	3.3080625
Chapter5_160_160.wav	Пайки, не спака, хариумамика.	4.364375
Chapter5_163_163.wav	What am I making?	1.165375
Chapter5_164_164.wav	Κι σπητσιούει, κι σπητσιούει, παντασκέν.	2.3535
Chapter5_166_166.wav	Sumah kau sayunya tiang tapika pipa sangka itu sama mi?	3.3896875
Chapter5_167_167.wav	特殊なパシミクなた親父	2.291
Chapter5_168_168.wav	Y en la micana.	1.35775
Chapter5_169_169.wav	& let me check	1.1223125
Chapter5_16_16.wav	Ma non la senticcio!	1.490625
Chapter5_176_176.wav	スマカウスライ、 クイチシナスマゴやチナアヌタ	4.2860625
Chapter5_178_178.wav	じゃあ、結構、スマークをさよいで、チェーンと!	2.3200625
Chapter5_179_179.wav	மன்னாட்டா!	1.03325
Chapter5_17_17.wav	Rura Sionci	1.4434375
Chapter5_180_180.wav	Сума гладит, Иглеичка!	1.853
Chapter5_181_181.wav	会じゃった間だとこやじょくなパァンにかうされたワグリティなほんぎっち!	4.6656875
Chapter5_182_182.wav	朝役をごともなぎちまし	1.770375
Chapter5_183_183.wav	Καίουαν για πατάκκα καπαρικουνάτα, κυρίεει πάπας!	3.034375
Chapter5_186_186.wav	― イマニスパターン ― ― スーカリワルミッカクタ ― ― オヤチナアンタビー リマチョン チョランギチー	7.70075
Chapter5_187_187.wav	Не аю, Веркани!	1.185
Chapter5_192_192.wav	Sinapas pa'y mikan guna takaasin ga?	3.8280625
Chapter5_193_193.wav	Уйтик!	1.287
Chapter5_194_194.wav	Manasaki Shunjo, cai mai tapas parla huwarmi, niukan tiwawa kunata wagli chichun!	6.938375
Chapter5_195_195.wav	Συνάπασκοί κύκει να τα που πάνι.	1.962125
Chapter5_196_196.wav	ما نولاك ها ما تباكي كي نجرحون	2.8335625
Chapter5_197_197.wav	Niukata kanimapi!	1.5625
Chapter5_199_199.wav	Și n-apas, nu că-i cunată oaglă tichul!	3.4734375
Chapter5_19_19.wav	きっきりやちゃんぎみいましんなかおさくしかった。	2.7318125
Chapter5_201_201.wav	ہاری وار میٹو ککہ کی میری انجانگمی	3.553125
Chapter5_202_202.wav	Hari war mikaika, kuru naberoztapaz, ja ali ungoizinamikan.	5.010125
Chapter5_203_203.wav	Cahitah cukup nak kamu nanggi, cik?	2.0303125
Chapter5_204_204.wav	予感をはくなかりわるみとこちょうもなんじぎみ	4.056625
Chapter5_205_205.wav	Kankunakanin ako ng itih karikanata, warimikanata, aksayos na zaminin ako ng itih.	7.2695625
Chapter5_206_206.wav	C'è il tamiga non è nascungiti!	2.2086875
Chapter5_207_207.wav	Hai siyukun na finyana hud chung wagli chung!	3.1895
Chapter5_208_208.wav	ジョーク世界満たすおばえ!ジョーク世界ジョーク世界満たすおばえ!ジョーク世界満たすおばえ!ジョーク世界満たすおばえ!ジョーク世界満たすおばえ!ジョーク世界満たすおばえ!ジョーク世界満たすおばえ!ジョーク世界満たすおばえ!ジョーク世界満たすおばえ!ジョーク世界満たすおばえ!ジョーク世界満たすおばえ!ジョーク世界満たすおばえ!ジョーク世界満たすおばえ!ジョーク世界満たすおばえ!ジョーク世界満たすおばえ!ジョーク世界満たすおばえ!ジョーク世界満たすおばえ!ジョーク世界満たすおばえ!ジョーク世界満たすおばえ!ジョーク世界満たすおばえ!ジョーク世界満たすおばえ!ジョーク世界満たすおばえ!ジョーク世界満たすおばえ!ジョーク世界満たすおばえ!ジョーク世界満たすおばえ!ジョーク世界満たすおばえ!ジョーク世界満たすおばえ!ジョーク世界満たすおばえ!ジョーク世界満たすおばえ!ジョーク世界満たすおばえ!ジョーク世界満たすおばえ!ジョーク世界満たすおばえ!ジョーク世界満たすおばえ!ジョーク世界満たすお	4.208375
Chapter5_209_209.wav	マシ、キキンマンがマナ役たからね、チョン	2.645125
Chapter5_20_20.wav	Iška i učila u kokunata začarinti.	2.665
Chapter5_211_211.wav	كوطيغ نيقاني سمي تاكيل بريباي	2.3105
Chapter5_219_219.wav	今なじゃん	1.2873125
Chapter5_222_222.wav	и починник иманцамышкоманда.	2.0688125
Chapter5_226_226.wav	いまにんぎ	1.0805625
Chapter5_228_228.wav	அلیمان دریببی	1.728625
Chapter5_229_229.wav	کہу, Sai Pika, tu kui, Pappa Pacha Kanna, Pichaiya Moomi!	4.2700625
Chapter5_230_230.wav	el tsunami, wowa.	1.6444375
Chapter5_231_231.wav	Bu sen ya minyak çacay amurka.	2.5154375
Chapter5_232_232.wav	Nya, midya, jani, maruhanata!	2.6775625
Chapter5_233_233.wav	நیامی یا چایی ماشینம مابکுناتا انچوچینات	3.6524375
Chapter5_234_234.wav	箱奏配	0.968875
Chapter5_235_235.wav	이만히 기!	0.8215625
Chapter5_24_24.wav	N'y ou pas qu'au chile à voici pimie, comme ça, ni?	2.4196875
Chapter5_26_26.wav	Ari Charini Mi	1.325875
Chapter5_27_27.wav	Pica con a pipa, juar cus, petar punaja més.	2.891625
Chapter5_30_30.wav	Tu cuita!	1.01025
Chapter5_31_31.wav	Brocolito mate, aselga, pimiento, sanaoria.	5.0683125
Chapter5_32_32.wav	Tūkų jūkuna taņu kancigalimiku nata Čarin gaba.	4.0185625
Chapter5_33_33.wav	ありみぐいたか、チャレンジインに、ニューカンチ流行なった、ムールコナタ、ホンだ、チスパミコナ感じ。	7.5969375
Chapter5_34_34.wav	یکہ چریشکہ لپاکہ ما نا لیچو	2.6308125
Chapter5_35_35.wav	چھے پیکہ منالی حیوپس مانا بینیانچ	3.5101875
Chapter5_36_36.wav	C'è i pami uonuta, ci areinci!	2.1496875
Chapter5_37_37.wav	かいかいまーいわっ	1.2731875
Chapter5_38_38.wav	まーん、なまーし	1.771125
Chapter5_39_39.wav	Tchau, snag!	1.1246875
Chapter5_40_40.wav	Mi-cuna cu n-amam datu cu ii puce cu nata, lul un caracunata, ce ai toculi tatandatispa, sugii jata ismucion s-a chinat.	9.5641875
Chapter5_41_41.wav	J.P. Ka, Kui Ka, Kunami, Zhang Kanga.	2.853125
Chapter5_42_42.wav	Quípamos a manga, traigo a un nuevo mundo, y para que no se vea más de un año, que no se vea más de un año, que no se vea más de un año, que no se vea más de un año, que no se vea más de un año, que no se vea más de un año, que no se vea más de un año, que no se vea más de un año, que no se vea más de un año, que no se vea más de un año, que no se vea más de un año, que no se vea más de un año, que no se vea más de un año, que no se vea más de un año, que no se vea más de un año, que no se vea más de un año, que no se vea más de un año, que no se vea más de un año, que no se vea más de un año, que no se vea más de un año, que no se vea más de un año, que no se vea más de un año, que no se vea más de un año, que no se vea más de un año, que no se vea más de un año, que no se vea más de un año, que no se vea más de un año, que no se vea más de un año, que no se vea más de un año, que no se vea más de un año, que no se vea más de un año, que no se vea más de un año, que no se vea más de un año, que no se vea más de un año, que no se vea más de un año, que no se vea más de un año, que no se vea más de un año, que no se vea más de un año, que no se vea más de un año, que no se vea más de un año, que no se vea más de un año, que no se vea más de un año, que no se vea más de un	6.089625
Chapter5_44_44.wav	Pai pes, casnatar puna, pambata, rosatja.	2.605125
Chapter5_47_47.wav	Χιουα η Ακούτα οφιασπα, μια ζάμια λίτου κόγκα.	3.4676875
Chapter5_48_48.wav	あります。こんな。ニャンミニュー感じぐやちがんたたチャレンチ。	3.3018125
Chapter5_49_49.wav	Sua causa ouia ciante.	1.8419375
Chapter5_50_50.wav	新apas ニュカンチーパー カウサナミカンチーパー	3.165625
Chapter5_51_51.wav	なっちうしなかん?	1.1420625
Chapter5_53_53.wav	Imata cewega ninggapang monanggiari.	2.6400625
Chapter5_55_55.wav	Nie ma kolki taj przynajmniej na chłonci.	1.9868125
Chapter5_56_56.wav	しなしみ	1.1189375
Chapter5_58_58.wav	Sina pas manan yuewanja, mone wanja mikuna kaasikorin gatsu.	4.6701875
Chapter5_5_5.wav	aam acha i roomi pijata ku te waktaringi cho na cho	4.1865625
Chapter5_60_60.wav	会社の会会した方くん	2.2979375
Chapter5_61_61.wav	Ainda que a gente ainda tem.	1.9214375
Chapter5_63_63.wav	Ari, ca-i ca aștacăpă ce pună tami apă.	3.5214375
Chapter5_64_64.wav	שינה פש נימקול גיטמנה חפינטית	3.2683125
Chapter5_68_68.wav	シンアーミシナミ	1.4746875
Chapter5_69_69.wav	Нагай, мата, глюра, шуменький.	1.82875
Chapter5_6_6.wav	منga...	1.091125
Chapter5_71_71.wav	死ながら、徹夜はんじゃまなかをさいたおささんに	3.057125
Chapter5_72_72.wav	siwagatong antakunaga tokuita apas pa zingunami ka?	3.353
Chapter5_73_73.wav	ユカンチをチーズアンタコナピカは近ぼちゃ今パスチャイアムスパカパンが	4.4663125
Chapter5_74_74.wav	しなかいまさたしなしょ	2.032875
Chapter5_77_77.wav	なっかんがちゅう	1.007875
Chapter5_79_79.wav	Sinami...	0.87225
Chapter5_7_7.wav	ki kingunarikongi chimang, suhha to mochi kutachurahushka, tan dana huy manda warmi kunata ya cha chihun.	7.601625
Chapter5_81_81.wav	Aștă că acum n-a tarrui ușanti.	1.93925
Chapter5_84_84.wav	Διακρινά κουνάτα τσουκάροια τίηση παρά μα για πακημυρίζια τένε φουνγάπ.	3.9961875
Chapter5_85_85.wav	Šujai šujai šujai taip paniukacarimi!	3.058
Chapter5_89_89.wav	Tu si cu natar ruiu santi!	1.7233125
Chapter5_90_90.wav	Cepi mapežmi kuna kunata, miski jakupunata, hatai jūsiant į.	4.04
Chapter5_92_92.wav	なしな感じを	1.1218125
Chapter5_93_93.wav	Eu sou uma parte do MV.	1.521125
Chapter5_94_94.wav	しなパチェイクなったが、ひぱまらじこしも	2.33175
Chapter5_95_95.wav	Τούσοι κουνάτάκα, όφια κουνάτάπας, νιάζουν να είχαζει καζάρια, νικπύρα, καζαρήσουν.	4.6208125
Chapter5_96_96.wav	Юя Рич и машина того, Минти Васипика и Алис Ката.	3.8110625
Chapter5_97_97.wav	イマシナかし方、マナ	2.4160625
Chapter5_98_98.wav	kunang bi pas jay kat yang ram	2.4438125
Chapter5_99_99.wav	오양기 치추	1.2101875
Chapter5_9_9.wav	多個星期五	2.1650625
Chapter6_102_102.wav	Que hi vaig aconapir, que em van anar a casa a tàmetes i que no ets cap.	4.444375
Chapter6_104_104.wav	Imanis, patăpătă pătăpătă mama ta hâcia cingi.	3.302875
Chapter6_106_106.wav	Sine a capit a fichorang!	1.552625
Chapter6_107_107.wav	ニュカンチ。ルナコンナーマイタチャーリー、カオサグルナコンナーカンチ。	5.4493125
Chapter6_109_109.wav	Нюкан Тигми по-тямамата воглить из Канти.	2.936625
Chapter6_10_10.wav	엄마 진개 지추	1.312375
Chapter6_110_110.wav	Συναζιάτά μην κλήμαπας μου σπαίσκα σινάμι που ρίχουν.	5.00075
Chapter6_111_111.wav	시갑아, 참이까봐	1.559375
Chapter6_112_112.wav	Natamia-ti-aspa ca cea-i ca faca mitia.	3.2001875
Chapter6_113_113.wav	Načai mandaja rupaiti aspa, rezu kupilejamiči ir.	4.898875
Chapter6_114_114.wav	Aari mana usaska akapanahatari pika ya ko akapanah cha yamun.	5.0959375
Chapter6_115_115.wav	Συνάπασά μαιακούτάζα χουτιατήτη.	3.1438125
Chapter6_118_118.wav	Вымаш пагати Пейти!	1.6790625
Chapter6_119_119.wav	Nuka ga wasi mandri pani! Manara yakua apak pijak!	3.5349375
Chapter6_11_11.wav	que hi mangueu que està catament i a t'imbo i que es arriu.	3.0635
Chapter6_120_120.wav	ニューカッパッシュ!	0.9888125
Chapter6_121_121.wav	Nyan Gunakan, hattoolar ka sinami kar ka, alkan tarizadu kunapas manapakter ka chu.	5.887125
Chapter6_122_122.wav	وککگنالی روراشکہ واسکوناپش گایمان چایمان کو یورینا حورکہ	4.1199375
Chapter6_123_123.wav	மانویلہ تاکہ چایتوک کی تامیاکہ ہو یا چیغانتا ہو کو پیجام کا ہو پیجاتا حپیر کا	6.0754375
Chapter6_124_124.wav	Súng mặc cao phải yếu yếu nhé, chỉ ăn tà chung	2.2046875
Chapter6_125_125.wav	Αριμάσοι είμα πιται για να πάσα.	2.28025
Chapter6_126_126.wav	Nyo ka manka niima!	1.5195625
Chapter6_128_128.wav	你也請我一家	1.0741875
Chapter6_129_129.wav	Asta tu cu ii pămbarisca!	1.6528125
Chapter6_131_131.wav	Suiai, suiai, o armei, ama já aqui, ai, tu, suiai.	3.076625
Chapter6_134_134.wav	aam ajaki aichu armi	1.569
Chapter6_137_137.wav	しなじゃん!しなじゃん!みかうせいかかん!	3.0944375
Chapter6_138_138.wav	Uyati antapak jau napaijuan, kis pirit atarirka.	3.472875
Chapter6_142_142.wav	わきにびっかく正化しなみか	3.246125
Chapter6_143_143.wav	من الوقت المتحدة	5.1541875
Chapter6_145_145.wav	Aikikinona Kaipikaspari kongitiman.	3.0879375
Chapter6_146_146.wav	Zaki Pachamarikanche	1.9445
Chapter6_147_147.wav	اشاش کا دامیا کا اشتا کا پنجا کناتا کتی ہو	3.480375
Chapter6_148_148.wav	ہات் தும்லார் காணாப்பஸ் பந்தார்கா, பம்பா குணாப்பஸ் குஞ்சையார்கா.	4.444
Chapter6_149_149.wav	Tarpos ka kunapas tinguas ka, ima vau wa kunapas tukui marioan uska.	5.0785
Chapter6_150_150.wav	Kuten vasko, niin vasuaktaitukus käsin?	2.922
Chapter6_152_152.wav	Pachamit to kugring chari	1.7591875
Chapter6_153_153.wav	Alitan ispaka, New Canji Tuku Ciri na kunci.	3.44575
Chapter6_154_154.wav	Ce-ai manta mi-o asipi tarpusca cu nakă mai manta alică. Ce-aișt națe aici i-a chipat ce-ai păceapii mi-cuna cu nakonata ce-i ringaba.	8.2703125
Chapter6_156_156.wav	Uczaj, zaróra na kancie.	1.647
Chapter6_157_157.wav	Ari! Hatun mangkapi anusung.	2.93275
Chapter6_158_158.wav	Нюканці я є мама-куна пахвача пісина.	3.2631875
Chapter6_159_159.wav	i arfai o angru nakunaka mi kunata ceri.	3.233625
Chapter6_15_15.wav	Y ahora, puca muy para con agua.	2.4548125
Chapter6_161_161.wav	¡Ay, Susa! ¡También da guardmico, no hay anusu!	3.739625
Chapter6_162_162.wav	wakin hariku napash nacha yana panga?	2.7625
Chapter6_163_163.wav	Ari, Sina Patia!	2.4438125
Chapter6_164_164.wav	Muru kunata-chari-kou na apamichi.	2.6905625
Chapter6_165_165.wav	Atălpată ceris papas, micună ată ceri cu ună, juraciu.	5.1746875
